{
  "schema_version": 1,
  "generated_at": "2026-10-14T09:00:00Z",
  "next_update_hint": "2026-10-14T09:30:00Z",
  "rank_change_basis_at": "2026-10-14T03:00:00Z",
  "cold_start": false,
  "items": [
    {
      "id": "kiss-of-life",
      "rank": 1,
      "prev_rank": null,
      "change": "new",
      "change_amount": 0,
      "name": "KISS OF LIFE",
      "name_ko": "키스오브라이프",
      "score": 67.0,
      "korea_first": true,
      "why": "\"Lucky Seven\" views up 4.0x vs. normal decay",
      "why_source": "template",
      "image_url": "https://i.ytimg.com/vi/SAMPLE0001A/hqdefault.jpg",
      "metrics": {
        "yt_views_per_hour": 20000,
        "yt_views_per_hour_estimated": false,
        "yt_accel": 4.0,
        "wiki_day": "2026-10-13",
        "wiki_ko_views": 1300,
        "wiki_ko_ratio": 3.25,
        "wiki_en_views": 1560,
        "wiki_en_ratio": 1.04,
        "headlines_24h": 1,
        "headlines_ko_24h": 1
      },
      "signals": {
        "youtube": 0.814,
        "accel": 1.0,
        "new_release": 0.0,
        "wiki": 0.683,
        "news": 0.26
      },
      "top_video": {
        "video_id": "SAMPLE0001A",
        "title": "KISS OF LIFE (키스오브라이프) 'Lucky Seven' Official MV",
        "url": "https://www.youtube.com/watch?v=SAMPLE0001A",
        "kind": "mv",
        "published_at": "2026-10-05T09:00:00Z",
        "views": 1620000,
        "channel_name": "KISS OF LIFE"
      },
      "headlines": [
        {
          "title": "[Sample] 키스오브라이프 '럭키 세븐' 역주행…음원차트 재진입",
          "url": "https://www.yna.co.kr/entertainment/all",
          "source_id": "yonhap",
          "source_name": "Yonhap",
          "lang": "ko",
          "published_at": "2026-10-14T05:00:00Z"
        }
      ],
      "links": {
        "youtube_channel": "https://www.youtube.com/channel/UCvEEeBssb4XxIfWWIB8IjMw",
        "wikipedia_en": "https://en.wikipedia.org/wiki/Kiss_of_Life_(group)",
        "wikipedia_ko": null
      }
    },
    {
      "id": "aespa",
      "rank": 2,
      "prev_rank": 4,
      "change": "up",
      "change_amount": 2,
      "name": "aespa",
      "name_ko": "에스파",
      "score": 63.1,
      "korea_first": true,
      "why": "New MV \"Neon Tide\" at 127K views/hr",
      "why_source": "template",
      "image_url": "https://i.ytimg.com/vi/SAMPLE0002A/hqdefault.jpg",
      "metrics": {
        "yt_views_per_hour": 126667,
        "yt_views_per_hour_estimated": false,
        "yt_accel": 0.96,
        "wiki_day": "2026-10-13",
        "wiki_ko_views": 9000,
        "wiki_ko_ratio": 3.0,
        "wiki_en_views": 13600,
        "wiki_en_ratio": 1.7,
        "headlines_24h": 3,
        "headlines_ko_24h": 2
      },
      "signals": {
        "youtube": 0.797,
        "accel": -0.03,
        "new_release": 0.625,
        "wiki": 0.74,
        "news": 0.366
      },
      "top_video": {
        "video_id": "SAMPLE0002A",
        "title": "aespa 에스파 'Neon Tide' MV",
        "url": "https://www.youtube.com/watch?v=SAMPLE0002A",
        "kind": "mv",
        "published_at": "2026-10-13T15:00:00Z",
        "views": 4580000,
        "channel_name": "SMTOWN"
      },
      "headlines": [
        {
          "title": "[Sample] aespa's \"Neon Tide\" MV Passes 4 Million Views",
          "url": "https://www.soompi.com/",
          "source_id": "soompi",
          "source_name": "Soompi",
          "lang": "en",
          "published_at": "2026-10-14T06:00:00Z"
        },
        {
          "title": "[Sample] 에스파, 신곡 '네온 타이드' 뮤직비디오 공개",
          "url": "https://www.yna.co.kr/entertainment/all",
          "source_id": "yonhap",
          "source_name": "Yonhap",
          "lang": "ko",
          "published_at": "2026-10-14T04:00:00Z"
        },
        {
          "title": "[Sample] 에스파, 오늘 정규 2집 발매",
          "url": "https://www.yna.co.kr/entertainment/all",
          "source_id": "yonhap",
          "source_name": "Yonhap",
          "lang": "ko",
          "published_at": "2026-10-13T13:00:00Z"
        }
      ],
      "links": {
        "youtube_channel": "https://www.youtube.com/channel/UC9GtSLeksfK4yuJ_g1lgQbg",
        "wikipedia_en": "https://en.wikipedia.org/wiki/Aespa",
        "wikipedia_ko": "https://ko.wikipedia.org/wiki/Aespa"
      }
    },
    {
      "id": "lim-young-woong",
      "rank": 3,
      "prev_rank": 3,
      "change": "same",
      "change_amount": 0,
      "name": "Lim Young-woong",
      "name_ko": "임영웅",
      "score": 41.8,
      "korea_first": true,
      "why": "2 Korean headlines, no English coverage yet",
      "why_source": "template",
      "image_url": "https://i.ytimg.com/vi/SAMPLE0003A/hqdefault.jpg",
      "metrics": {
        "yt_views_per_hour": 9100,
        "yt_views_per_hour_estimated": false,
        "yt_accel": 1.12,
        "wiki_day": "2026-10-13",
        "wiki_ko_views": 21000,
        "wiki_ko_ratio": 1.38,
        "wiki_en_views": 900,
        "wiki_en_ratio": 0.98,
        "headlines_24h": 2,
        "headlines_ko_24h": 2
      },
      "signals": {
        "youtube": 0.401,
        "accel": 0.041,
        "new_release": 0.0,
        "wiki": 0.214,
        "news": 0.433
      },
      "top_video": {
        "video_id": "SAMPLE0003A",
        "title": "[MV] 임영웅 - 가을 편지 (Autumn Letter)",
        "url": "https://www.youtube.com/watch?v=SAMPLE0003A",
        "kind": "mv",
        "published_at": "2026-10-02T09:00:00Z",
        "views": 2310000,
        "channel_name": "임영웅"
      },
      "headlines": [
        {
          "title": "[Sample] 임영웅, 전국투어 추가 공연 전석 매진",
          "url": "https://www.yna.co.kr/entertainment/all",
          "source_id": "yonhap",
          "source_name": "Yonhap",
          "lang": "ko",
          "published_at": "2026-10-14T02:00:00Z"
        },
        {
          "title": "[Sample] 임영웅 '가을 편지' 멜론 일간 1위",
          "url": "https://www.yna.co.kr/entertainment/all",
          "source_id": "yonhap",
          "source_name": "Yonhap",
          "lang": "ko",
          "published_at": "2026-10-13T23:30:00Z"
        }
      ],
      "links": {
        "youtube_channel": null,
        "wikipedia_en": "https://en.wikipedia.org/wiki/Lim_Young-woong",
        "wikipedia_ko": "https://ko.wikipedia.org/wiki/%EC%9E%84%EC%98%81%EC%9B%85"
      }
    },
    {
      "id": "seventeen",
      "rank": 4,
      "prev_rank": 2,
      "change": "down",
      "change_amount": 2,
      "name": "SEVENTEEN",
      "name_ko": "세븐틴",
      "score": 20.2,
      "korea_first": false,
      "why": "6 headlines in 24h (1 Korean)",
      "why_source": "template",
      "image_url": "https://i.ytimg.com/vi/SAMPLE0004A/hqdefault.jpg",
      "metrics": {
        "yt_views_per_hour": 7584,
        "yt_views_per_hour_estimated": true,
        "yt_accel": null,
        "wiki_day": "2026-10-13",
        "wiki_ko_views": 5200,
        "wiki_ko_ratio": 1.04,
        "wiki_en_views": 23000,
        "wiki_en_ratio": 1.15,
        "headlines_24h": 6,
        "headlines_ko_24h": 1
      },
      "signals": {
        "youtube": 0.354,
        "accel": 0.0,
        "new_release": 0.0,
        "wiki": 0.042,
        "news": 0.465
      },
      "top_video": {
        "video_id": "SAMPLE0004A",
        "title": "SEVENTEEN (세븐틴) 'Afterglow' Performance Film",
        "url": "https://www.youtube.com/watch?v=SAMPLE0004A",
        "kind": "perf",
        "published_at": "2026-10-12T09:00:00Z",
        "views": 900000,
        "channel_name": "HYBE LABELS"
      },
      "headlines": [
        {
          "title": "[Sample] 세븐틴, 월드투어 서울 공연 성료",
          "url": "https://www.yna.co.kr/entertainment/all",
          "source_id": "yonhap",
          "source_name": "Yonhap",
          "lang": "ko",
          "published_at": "2026-10-14T08:00:00Z"
        },
        {
          "title": "[Sample] SEVENTEEN Wraps Seoul Leg Of World Tour",
          "url": "https://www.soompi.com/",
          "source_id": "soompi",
          "source_name": "Soompi",
          "lang": "en",
          "published_at": "2026-10-14T07:00:00Z"
        },
        {
          "title": "[Sample] SEVENTEEN's Encore Moment Goes Viral",
          "url": "https://www.koreaboo.com/",
          "source_id": "koreaboo",
          "source_name": "Koreaboo",
          "lang": "en",
          "published_at": "2026-10-14T01:00:00Z"
        }
      ],
      "links": {
        "youtube_channel": "https://www.youtube.com/channel/UCfkXDY7vwkcJ8ddFGz8KusA",
        "wikipedia_en": "https://en.wikipedia.org/wiki/Seventeen_(South_Korean_band)",
        "wikipedia_ko": "https://ko.wikipedia.org/wiki/%EC%84%B8%EB%B8%90%ED%8B%B4_(%EC%9D%8C%EC%95%85_%EA%B7%B8%EB%A3%B9)"
      }
    },
    {
      "id": "le-sserafim",
      "rank": 5,
      "prev_rank": 7,
      "change": "up",
      "change_amount": 2,
      "name": "LE SSERAFIM",
      "name_ko": "르세라핌",
      "score": 19.6,
      "korea_first": false,
      "why": "English Wikipedia views 2.1x the 2-week avg",
      "why_source": "template",
      "image_url": "https://i.ytimg.com/vi/SAMPLE0005A/hqdefault.jpg",
      "metrics": {
        "yt_views_per_hour": 5200,
        "yt_views_per_hour_estimated": false,
        "yt_accel": 1.05,
        "wiki_day": "2026-10-13",
        "wiki_ko_views": 6100,
        "wiki_ko_ratio": 1.1,
        "wiki_en_views": 31000,
        "wiki_en_ratio": 2.1,
        "headlines_24h": 1,
        "headlines_ko_24h": 0
      },
      "signals": {
        "youtube": 0.31,
        "accel": 0.018,
        "new_release": 0.0,
        "wiki": 0.24,
        "news": 0.12
      },
      "top_video": {
        "video_id": "SAMPLE0005A",
        "title": "LE SSERAFIM (르세라핌) 'Paper Crown' OFFICIAL MV",
        "url": "https://www.youtube.com/watch?v=SAMPLE0005A",
        "kind": "mv",
        "published_at": "2026-09-30T09:00:00Z",
        "views": 38200000,
        "channel_name": "HYBE LABELS"
      },
      "headlines": [
        {
          "title": "[Sample] LE SSERAFIM Announces North American Tour Dates",
          "url": "https://www.soompi.com/",